[0 ms] UsbSnoop compiled on Jan 18 2003 22:41:32 loading
[0 ms] UsbSnoop - DriverEntry(f7941c40) : Windows NT WDM version 1.32
[2 ms] UsbSnoop - AddDevice(f7941f50) : DriverObject 84400478, pdo 8476dba8
[2 ms] UsbSnoop - DispatchAny(f793f610) : IRP_MJ_PNP (0x00000018)
[2 ms] UsbSnoop - MyDispatchPNP(f7941ee0) : IRP_MJ_PNP (0x00000018)
[64 ms] UsbSnoop - DispatchAny(f793f610) : IRP_MJ_PNP (IRP_MN_QUERY_RESOURCE_REQUIREMENTS)
[64 ms] UsbSnoop - MyDispatchPNP(f7941ee0) : IRP_MJ_PNP (IRP_MN_QUERY_RESOURCE_REQUIREMENTS)
[64 ms] UsbSnoop - DispatchAny(f793f610) : IRP_MJ_PNP (IRP_MN_FILTER_RESOURCE_REQUIREMENTS)
[64 ms] UsbSnoop - MyDispatchPNP(f7941ee0) : IRP_MJ_PNP (IRP_MN_FILTER_RESOURCE_REQUIREMENTS)
[275 ms] UsbSnoop - MyDispatchPNP(f7941ee0) : IRP_MJ_PNP (IRP_MN_QUERY_CAPABILITIES)
[275 ms] UsbSnoop - DispatchAny(f793f610) : IRP_MJ_PNP (IRP_MN_START_DEVICE)
[275 ms] UsbSnoop - MyDispatchPNP(f7941ee0) : IRP_MJ_PNP (IRP_MN_START_DEVICE)
[275 ms] UsbSnoop - DispatchAny(f793f610) : IRP_MJ_INTERNAL_DEVICE_CONTROL
[275 ms] UsbSnoop - MyDispatchInternalIOCTL(f7940e80) : fdo=8476dba8, Irp=84619930, IRQL=0
[275 ms]  >>>  URB 1 going down  >>> 
-- URB_FUNCTION_GET_DESCRIPTOR_FROM_DEVICE:
  TransferBufferLength = 00000012
  TransferBuffer       = 844a1cf0
  TransferBufferMDL    = 00000000
  Index                = 00000000
  DescriptorType       = 00000001 (USB_DEVICE_DESCRIPTOR_TYPE)
  LanguageId           = 00000000
[275 ms] UsbSnoop - MyInternalIOCTLCompletion(f7940db0) : fido=00000000, Irp=84619930, Context=844eed60, IRQL=0
[275 ms]  <<<  URB 1 coming back  <<< 
-- URB_FUNCTION_GET_DESCRIPTOR_FROM_DEVICE:
  TransferBufferLength = 00000012
  TransferBuffer       = 844a1cf0
  TransferBufferMDL    = 00000000
    00000000: 12 01 10 01 00 00 00 08 6d 04 07 0a 1e 00 01 02
    00000010: 00 01
  Index                = 00000000
  DescriptorType       = 00000001 (USB_DEVICE_DESCRIPTOR_TYPE)
  LanguageId           = 00000000
[275 ms] UsbSnoop - DispatchAny(f793f610) : IRP_MJ_INTERNAL_DEVICE_CONTROL
[275 ms] UsbSnoop - MyDispatchInternalIOCTL(f7940e80) : fdo=8476dba8, Irp=84619930, IRQL=0
[275 ms]  >>>  URB 2 going down  >>> 
-- URB_FUNCTION_GET_DESCRIPTOR_FROM_DEVICE:
  TransferBufferLength = 00000009
  TransferBuffer       = 84524bf0
  TransferBufferMDL    = 00000000
  Index                = 00000000
  DescriptorType       = 00000002 (USB_CONFIGURATION_DESCRIPTOR_TYPE)
  LanguageId           = 00000000
[275 ms] UsbSnoop - MyInternalIOCTLCompletion(f7940db0) : fido=00000000, Irp=84619930, Context=847668d8, IRQL=0
[275 ms]  <<<  URB 2 coming back  <<< 
-- URB_FUNCTION_GET_DESCRIPTOR_FROM_DEVICE:
  TransferBufferLength = 00000009
  TransferBuffer       = 84524bf0
  TransferBufferMDL    = 00000000
    00000000: 09 02 29 00 01 01 03 e0 00
  Index                = 00000000
  DescriptorType       = 00000002 (USB_CONFIGURATION_DESCRIPTOR_TYPE)
  LanguageId           = 00000000
[275 ms] UsbSnoop - DispatchAny(f793f610) : IRP_MJ_INTERNAL_DEVICE_CONTROL
[275 ms] UsbSnoop - MyDispatchInternalIOCTL(f7940e80) : fdo=8476dba8, Irp=84619930, IRQL=0
[275 ms]  >>>  URB 3 going down  >>> 
-- URB_FUNCTION_GET_DESCRIPTOR_FROM_DEVICE:
  TransferBufferLength = 00000029
  TransferBuffer       = 8476b780
  TransferBufferMDL    = 00000000
  Index                = 00000000
  DescriptorType       = 00000002 (USB_CONFIGURATION_DESCRIPTOR_TYPE)
  LanguageId           = 00000000
[275 ms] UsbSnoop - MyInternalIOCTLCompletion(f7940db0) : fido=00000000, Irp=84619930, Context=84408d80, IRQL=0
[275 ms]  <<<  URB 3 coming back  <<< 
-- URB_FUNCTION_GET_DESCRIPTOR_FROM_DEVICE:
  TransferBufferLength = 00000029
  TransferBuffer       = 8476b780
  TransferBufferMDL    = 00000000
    00000000: 09 02 29 00 01 01 03 e0 00 09 04 02 00 02 03 00
    00000010: 00 00 09 21 10 01 00 01 22 2e 00 07 05 83 03 09
    00000020: 00 0a 07 05 03 03 40 00 01
  Index                = 00000000
  DescriptorType       = 00000002 (USB_CONFIGURATION_DESCRIPTOR_TYPE)
  LanguageId           = 00000000
[276 ms] UsbSnoop - DispatchAny(f793f610) : IRP_MJ_INTERNAL_DEVICE_CONTROL
[276 ms] UsbSnoop - MyDispatchInternalIOCTL(f7940e80) : fdo=8476dba8, Irp=84619930, IRQL=0
[276 ms]  >>>  URB 4 going down  >>> 
-- URB_FUNCTION_SELECT_CONFIGURATION:
  ConfigurationDescriptor = 0x8476b780 (configure)
  ConfigurationDescriptor : bLength             = 9
  ConfigurationDescriptor : bDescriptorType     = 0x00000002
  ConfigurationDescriptor : wTotalLength        = 0x00000029
  ConfigurationDescriptor : bNumInterfaces      = 0x00000001
  ConfigurationDescriptor : bConfigurationValue = 0x00000001
  ConfigurationDescriptor : iConfiguration      = 0x00000003
  ConfigurationDescriptor : bmAttributes        = 0x000000e0
  ConfigurationDescriptor : MaxPower            = 0x00000000
  ConfigurationHandle     = 0x00000000
  Interface[0]: Length            = 56
  Interface[0]: InterfaceNumber   = 2
  Interface[0]: AlternateSetting  = 0
[276 ms] UsbSnoop - MyInternalIOCTLCompletion(f7940db0) : fido=00000000, Irp=84619930, Context=843f26c0, IRQL=0
[276 ms]  <<<  URB 4 coming back  <<< 
-- URB_FUNCTION_SELECT_CONFIGURATION:
  ConfigurationDescriptor = 0x8476b780 (configure)
  ConfigurationDescriptor : bLength             = 9
  ConfigurationDescriptor : bDescriptorType     = 0x00000002
  ConfigurationDescriptor : wTotalLength        = 0x00000029
  ConfigurationDescriptor : bNumInterfaces      = 0x00000001
  ConfigurationDescriptor : bConfigurationValue = 0x00000001
  ConfigurationDescriptor : iConfiguration      = 0x00000003
  ConfigurationDescriptor : bmAttributes        = 0x000000e0
  ConfigurationDescriptor : MaxPower            = 0x00000000
  ConfigurationHandle     = 0x845ec290
  Interface[0]: Length            = 56
  Interface[0]: InterfaceNumber   = 2
  Interface[0]: AlternateSetting  = 0
  Interface[0]: Class             = 0x00000003
  Interface[0]: SubClass          = 0x00000000
  Interface[0]: Protocol          = 0x00000000
  Interface[0]: InterfaceHandle   = 0x8469e898
  Interface[0]: NumberOfPipes     = 2
  Interface[0]: Pipes[0] : MaximumPacketSize = 0x00000009
  Interface[0]: Pipes[0] : EndpointAddress   = 0x00000083
  Interface[0]: Pipes[0] : Interval          = 0x0000000a
  Interface[0]: Pipes[0] : PipeType          = 0x00000003 (UsbdPipeTypeInterrupt)
  Interface[0]: Pipes[0] : PipeHandle        = 0x8469e8b4
  Interface[0]: Pipes[0] : MaxTransferSize   = 0x00001000
  Interface[0]: Pipes[0] : PipeFlags         = 0x00000000
  Interface[0]: Pipes[1] : MaximumPacketSize = 0x00000040
  Interface[0]: Pipes[1] : EndpointAddress   = 0x00000003
  Interface[0]: Pipes[1] : Interval          = 0x00000001
  Interface[0]: Pipes[1] : PipeType          = 0x00000003 (UsbdPipeTypeInterrupt)
  Interface[0]: Pipes[1] : PipeHandle        = 0x8469e8d4
  Interface[0]: Pipes[1] : MaxTransferSize   = 0x00001000
  Interface[0]: Pipes[1] : PipeFlags         = 0x00000000
[276 ms] UsbSnoop - DispatchAny(f793f610) : IRP_MJ_INTERNAL_DEVICE_CONTROL
[276 ms] UsbSnoop - MyDispatchInternalIOCTL(f7940e80) : fdo=8476dba8, Irp=84619930, IRQL=0
[276 ms]  >>>  URB 5 going down  >>> 
-- URB_FUNCTION_CLASS_INTERFACE:
  TransferFlags          = 00000000 (USBD_TRANSFER_DIRECTION_OUT, ~USBD_SHORT_TRANSFER_OK)
  TransferBufferLength = 00000000
  TransferBuffer       = 00000000
  TransferBufferMDL    = 00000000

    no data supplied
  UrbLink                 = 00000000
  RequestTypeReservedBits = 00000022
  Request                 = 0000000a
  Value                   = 00000000
  Index                   = 00000002
[292 ms] UsbSnoop - MyInternalIOCTLCompletion(f7940db0) : fido=00000000, Irp=84619930, Context=84405b38, IRQL=2
[292 ms]  <<<  URB 5 coming back  <<< 
-- URB_FUNCTION_CONTROL_TRANSFER:
  PipeHandle           = 84406ed8
  TransferFlags        = 0000000a (USBD_TRANSFER_DIRECTION_OUT, USBD_SHORT_TRANSFER_OK)
  TransferBufferLength = 00000000
  TransferBuffer       = 00000000
  TransferBufferMDL    = 00000000
  UrbLink              = 00000000
  SetupPacket          =
    00000000: 21 0a 00 00 02 00 00 00
[292 ms] UsbSnoop - DispatchAny(f793f610) : IRP_MJ_INTERNAL_DEVICE_CONTROL
[292 ms] UsbSnoop - MyDispatchInternalIOCTL(f7940e80) : fdo=8476dba8, Irp=843ddae8, IRQL=0
[292 ms]  >>>  URB 6 going down  >>> 
-- URB_FUNCTION_GET_DESCRIPTOR_FROM_INTERFACE:
  TransferBufferLength = 0000006e
  TransferBuffer       = 8449dc80
  TransferBufferMDL    = 00000000
  Index                = 00000000
  DescriptorType       = 00000022 (<illegal descriptor type!>)
  LanguageId           = 00000002
[320 ms] UsbSnoop - MyInternalIOCTLCompletion(f7940db0) : fido=00000000, Irp=843ddae8, Context=8476feb0, IRQL=2
[320 ms]  <<<  URB 6 coming back  <<< 
-- URB_FUNCTION_CONTROL_TRANSFER:
  PipeHandle           = 84406ed8
  TransferFlags        = 0000000b (USBD_TRANSFER_DIRECTION_IN, USBD_SHORT_TRANSFER_OK)
  TransferBufferLength = 0000002e
  TransferBuffer       = 8449dc80
  TransferBufferMDL    = 845e0e38
    00000000: 06 00 ff 09 00 a1 01 15 00 26 ff 00 75 08 95 08
    00000010: 06 00 ff 09 02 85 02 06 00 ff 09 03 81 02 09 04
    00000020: 95 03 b1 02 09 06 85 03 96 df 03 91 02 c0
  UrbLink              = 00000000
  SetupPacket          =
    00000000: 81 06 00 22 02 00 6e 00
[320 ms] UsbSnoop - DispatchAny(f793f610) : IRP_MJ_PNP (IRP_MN_QUERY_CAPABILITIES)
[320 ms] UsbSnoop - MyDispatchPNP(f7941ee0) : IRP_MJ_PNP (IRP_MN_QUERY_CAPABILITIES)
[320 ms] UsbSnoop - DispatchAny(f793f610) : IRP_MJ_PNP (IRP_MN_QUERY_PNP_DEVICE_STATE)
[320 ms] UsbSnoop - MyDispatchPNP(f7941ee0) : IRP_MJ_PNP (IRP_MN_QUERY_PNP_DEVICE_STATE)
[320 ms] UsbSnoop - DispatchAny(f793f610) : IRP_MJ_PNP (IRP_MN_QUERY_DEVICE_RELATIONS)
[320 ms] UsbSnoop - MyDispatchPNP(f7941ee0) : IRP_MJ_PNP (IRP_MN_QUERY_DEVICE_RELATIONS)
[320 ms] UsbSnoop - DispatchAny(f793f610) : IRP_MJ_PNP (IRP_MN_QUERY_ID)
[320 ms] UsbSnoop - MyDispatchPNP(f7941ee0) : IRP_MJ_PNP (IRP_MN_QUERY_ID)
[320 ms] UsbSnoop - DispatchAny(f793f610) : IRP_MJ_PNP (IRP_MN_QUERY_ID)
[320 ms] UsbSnoop - MyDispatchPNP(f7941ee0) : IRP_MJ_PNP (IRP_MN_QUERY_ID)
[385 ms] UsbSnoop - DispatchAny(f793f610) : IRP_MJ_INTERNAL_DEVICE_CONTROL
[385 ms] UsbSnoop - MyDispatchInternalIOCTL(f7940e80) : fdo=8476dba8, Irp=84619930, IRQL=0
[385 ms]  >>>  URB 7 going down  >>> 
-- URB_FUNCTION_BULK_OR_INTERRUPT_TRANSFER:
  PipeHandle           = 8469e8b4 [endpoint 0x00000083]
  TransferFlags        = 00000003 (USBD_TRANSFER_DIRECTION_IN, USBD_SHORT_TRANSFER_OK)
  TransferBufferLength = 00000009
  TransferBuffer       = 8440cd98
  TransferBufferMDL    = 00000000
  UrbLink              = 00000000
[385 ms] UsbSnoop - DispatchAny(f793f610) : IRP_MJ_INTERNAL_DEVICE_CONTROL
[385 ms] UsbSnoop - MyDispatchInternalIOCTL(f7940e80) : fdo=8476dba8, Irp=843ddae8, IRQL=0
[385 ms]  >>>  URB 8 going down  >>> 
-- URB_FUNCTION_BULK_OR_INTERRUPT_TRANSFER:
  PipeHandle           = 8469e8b4 [endpoint 0x00000083]
  TransferFlags        = 00000003 (USBD_TRANSFER_DIRECTION_IN, USBD_SHORT_TRANSFER_OK)
  TransferBufferLength = 00000009
  TransferBuffer       = 847645f8
  TransferBufferMDL    = 00000000
  UrbLink              = 00000000
[385 ms] UsbSnoop - DispatchAny(f793f610) : IRP_MJ_PNP (IRP_MN_QUERY_DEVICE_RELATIONS)
[385 ms] UsbSnoop - MyDispatchPNP(f7941ee0) : IRP_MJ_PNP (IRP_MN_QUERY_DEVICE_RELATIONS)
[435 ms] UsbSnoop - DispatchAny(f793f610) : IRP_MJ_INTERNAL_DEVICE_CONTROL
[435 ms] UsbSnoop - MyDispatchInternalIOCTL(f7940e80) : fdo=8476dba8, Irp=846ac008, IRQL=0
[435 ms]  >>>  URB 9 going down  >>> 
-- URB_FUNCTION_CLASS_INTERFACE:
  TransferFlags          = 00000000 (USBD_TRANSFER_DIRECTION_OUT, ~USBD_SHORT_TRANSFER_OK)
  TransferBufferLength = 00000004
  TransferBuffer       = 8466ad68
  TransferBufferMDL    = 00000000
    00000000: 02 02 10 00
  UrbLink                 = 00000000
  RequestTypeReservedBits = 00000022
  Request                 = 00000009
  Value                   = 00000302
  Index                   = 00000002
[449 ms] UsbSnoop - MyInternalIOCTLCompletion(f7940db0) : fido=84661030, Irp=846ac008, Context=8476feb0, IRQL=2
[449 ms]  <<<  URB 9 coming back  <<< 
-- URB_FUNCTION_CONTROL_TRANSFER:
  PipeHandle           = 84406ed8
  TransferFlags        = 0000000a (USBD_TRANSFER_DIRECTION_OUT, USBD_SHORT_TRANSFER_OK)
  TransferBufferLength = 00000004
  TransferBuffer       = 8466ad68
  TransferBufferMDL    = 8439d1a0
  UrbLink              = 00000000
  SetupPacket          =
    00000000: 21 09 02 03 02 00 04 00
[449 ms] UsbSnoop - DispatchAny(f793f610) : IRP_MJ_INTERNAL_DEVICE_CONTROL
[449 ms] UsbSnoop - MyDispatchInternalIOCTL(f7940e80) : fdo=8476dba8, Irp=846ac008, IRQL=0
[449 ms]  >>>  URB 10 going down  >>> 
-- URB_FUNCTION_CLASS_INTERFACE:
  TransferFlags          = 00000000 (USBD_TRANSFER_DIRECTION_OUT, ~USBD_SHORT_TRANSFER_OK)
  TransferBufferLength = 00000004
  TransferBuffer       = 8466ad68
  TransferBufferMDL    = 00000000
    00000000: 02 02 10 00
  UrbLink                 = 00000000
  RequestTypeReservedBits = 00000022
  Request                 = 00000009
  Value                   = 00000302
  Index                   = 00000002
[468 ms] UsbSnoop - MyInternalIOCTLCompletion(f7940db0) : fido=84661030, Irp=846ac008, Context=8453cfe8, IRQL=2
[468 ms]  <<<  URB 10 coming back  <<< 
-- URB_FUNCTION_CONTROL_TRANSFER:
  PipeHandle           = 84406ed8
  TransferFlags        = 0000000a (USBD_TRANSFER_DIRECTION_OUT, USBD_SHORT_TRANSFER_OK)
  TransferBufferLength = 00000004
  TransferBuffer       = 8466ad68
  TransferBufferMDL    = 8439d1a0
  UrbLink              = 00000000
  SetupPacket          =
    00000000: 21 09 02 03 02 00 04 00
[468 ms] UsbSnoop - DispatchAny(f793f610) : IRP_MJ_INTERNAL_DEVICE_CONTROL
[468 ms] UsbSnoop - MyDispatchInternalIOCTL(f7940e80) : fdo=8476dba8, Irp=846ac008, IRQL=0
[468 ms]  >>>  URB 11 going down  >>> 
-- URB_FUNCTION_CLASS_INTERFACE:
  TransferFlags          = 00000000 (USBD_TRANSFER_DIRECTION_OUT, ~USBD_SHORT_TRANSFER_OK)
  TransferBufferLength = 00000004
  TransferBuffer       = 8466ad68
  TransferBufferMDL    = 00000000
    00000000: 02 20 81 00
  UrbLink                 = 00000000
  RequestTypeReservedBits = 00000022
  Request                 = 00000009
  Value                   = 00000302
  Index                   = 00000002
[469 ms] UsbSnoop - DispatchAny(f793f610) : IRP_MJ_INTERNAL_DEVICE_CONTROL
[469 ms] UsbSnoop - MyDispatchInternalIOCTL(f7940e80) : fdo=8476dba8, Irp=845ea748, IRQL=0
[469 ms]  >>>  URB 12 going down  >>> 
-- URB_FUNCTION_BULK_OR_INTERRUPT_TRANSFER:
  PipeHandle           = 8469e8d4 [endpoint 0x00000003]
  TransferFlags        = 00000002 (USBD_TRANSFER_DIRECTION_OUT, USBD_SHORT_TRANSFER_OK)
  TransferBufferLength = 000003e0
  TransferBuffer       = f7b90790
  TransferBufferMDL    = 00000000
    00000000: 03 00 00 00 00 00 00 00 00 00 00 00 00 00 00 00
    00000010: 00 00 00 00 00 00 00 00 00 00 00 00 00 00 00 00
    00000020: 00 00 00 00 00 00 00 00 00 00 80 c0 e0 f0 f0 f8
    00000030: fc fc fe fe fe ff ff ff ff ff 3f 1f 06 00 00 00
    00000040: 00 00 00 00 00 00 00 00 00 80 c0 e0 f0 f8 fc 7e
    00000050: 7e 3e 1e 0c 00 00 00 00 00 00 00 00 00 00 00 00
    00000060: 00 00 00 00 00 00 00 00 00 00 00 00 00 00 00 00
    00000070: 00 00 00 00 00 00 00 00 00 00 00 00 00 00 00 00
    00000080: 00 00 00 00 00 00 00 00 00 00 00 00 00 00 00 00
    00000090: 00 00 00 00 00 00 00 00 00 00 00 00 00 00 00 00
    000000a0: 00 00 00 00 00 00 00 00 00 00 00 00 00 00 00 00
    000000b0: 00 00 00 00 00 00 00 00 00 00 00 00 00 00 00 00
    000000c0: 00 00 00 00 00 80 e0 f8 fc ff ff ff ff ff ff ff
    000000d0: ff ff ff ff ff ff 3f 0f 03 00 00 00 00 80 80 80
    000000e0: c0 c0 c0 c0 c0 c0 80 80 80 03 03 01 01 01 00 00
    000000f0: 00 00 00 00 00 00 00 00 00 00 00 00 00 00 00 00
    00000100: 00 00 00 00 00 00 00 00 00 f0 f0 f0 00 00 00 00
    00000110: 00 00 00 00 00 00 00 00 00 00 00 00 00 00 00 00
    00000120: 00 00 00 00 00 00 00 00 00 00 00 00 38 38 38 00
    00000130: 00 00 e0 e0 e0 00 00 00 00 00 00 00 00 00 00 00
    00000140: 00 00 00 00 00 00 00 00 00 00 00 00 00 00 f8 f8
    00000150: f8 00 00 00 00 00 00 00 00 00 00 00 00 00 00 00
    00000160: 00 00 00 00 fc ff ff ff ff ff ff ff ff ff ff ff
    00000170: ff ff ff ff ff 83 00 00 f8 fc fe ff ff cf e7 fb
    00000180: fb 1f 0f 07 07 07 07 8f ff ff ff fe fc 00 00 20
    00000190: 70 70 f0 f0 f0 f0 f0 f0 f0 f0 60 20 00 00 00 00
    000001a0: 00 00 00 00 00 00 00 00 00 ff ff ff 00 00 00 00
    000001b0: 00 f8 fc fe 07 03 03 03 03 07 fe fc f8 00 f8 fc
    000001c0: fe 0f 07 03 03 03 03 ff ff ff 00 00 ff ff ff 00
    000001d0: 03 03 ff ff ff 03 03 03 f8 fe fe 33 33 33 33 33
    000001e0: 3f 3e 3c f0 fc fe 0f 03 03 03 03 03 03 02 ff ff
    000001f0: ff 03 03 03 03 03 ff fe f8 00 03 03 00 00 00 00
    00000200: 00 00 00 00 0f 7f ff ff ff ff ff ff ff ff ff ff
    00000210: ff ff ff ff ff ff f8 e0 c1 03 03 07 0f 3f 7f 7f
    00000220: 7f 6f 4f 6e 6e 3f 1f 1f 0f 07 03 01 00 00 00 00
    00000230: 00 00 00 00 00 00 00 00 00 00 00 00 00 00 00 00
    00000240: 00 00 00 00 00 00 00 00 00 0f 0f 0f 0c 0c 0c 0c
    00000250: 0c 0d 03 07 0e 0c 0c 0c 0c 0e 07 03 01 00 c1 c3
    00000260: 87 8f 8e 8c 8c 8c 8c ff ff 7f 00 00 0f 0f 0f 00
    00000270: 00 00 07 0f 0f 0c 0c 0c 01 03 07 0e 0c 0c 0c 0c
    00000280: 0c 0e 00 00 03 07 0f 0c 0c 0c 0c 0c 0c 04 0f 0f
    00000290: 0f 00 00 00 00 00 0f 0f 0f 00 00 00 00 00 00 00
    000002a0: 00 00 00 00 00 00 01 03 0f 1f 3f 7f ff ff ff ff
    000002b0: ff ff ff ff ff ff ff ff ff fe 00 00 00 00 00 00
    000002c0: 00 00 00 00 00 00 00 00 00 00 00 00 0e 3e 7c fc
    000002d0: f8 f0 f0 e0 c0 00 00 00 00 00 00 00 00 00 00 00
    000002e0: 00 00 00 00 00 00 00 00 00 00 00 00 00 00 00 00
    000002f0: 00 00 00 00 00 00 00 00 00 00 00 00 00 00 00 00
    00000300: 01 01 01 01 01 01 01 00 00 00 00 00 00 00 00 00
    00000310: 00 00 00 00 00 00 00 00 00 00 00 00 00 00 00 00
    00000320: 00 00 00 00 00 00 00 00 00 00 00 00 fc 00 00 00
    00000330: 00 00 f8 04 04 04 04 08 00 fc 04 04 04 08 f0 00
    00000340: 00 00 00 00 00 00 00 00 00 00 00 00 00 01 01 03
    00000350: 03 07 07 07 07 07 07 03 01 00 00 00 00 00 00 00
    00000360: 00 00 00 00 00 00 00 00 00 00 00 00 00 00 00 00
    00000370: 00 01 03 03 07 07 00 00 00 00 00 00 00 00 00 00
    00000380: 00 00 00 00 00 00 00 00 00 00 00 00 00 00 00 00
    00000390: 00 00 00 00 00 00 00 00 00 00 00 00 00 00 00 00
    000003a0: 00 00 00 00 00 00 00 00 00 00 00 00 00 00 00 00
    000003b0: 00 00 00 00 00 00 00 00 00 00 00 00 00 00 00 00
    000003c0: 00 00 00 00 00 00 00 00 00 00 00 00 07 04 04 04
    000003d0: 04 00 03 04 04 04 04 02 00 07 04 04 04 02 01 00
  UrbLink              = 00000000
[483 ms] UsbSnoop - MyInternalIOCTLCompletion(f7940db0) : fido=84661030, Irp=846ac008, Context=847668d8, IRQL=2
[483 ms]  <<<  URB 11 coming back  <<< 
-- URB_FUNCTION_CONTROL_TRANSFER:
  PipeHandle           = 84406ed8
  TransferFlags        = 0000000a (USBD_TRANSFER_DIRECTION_OUT, USBD_SHORT_TRANSFER_OK)
  TransferBufferLength = 00000004
  TransferBuffer       = 8466ad68
  TransferBufferMDL    = 8439d1a0
  UrbLink              = 00000000
  SetupPacket          =
    00000000: 21 09 02 03 02 00 04 00
[523 ms] UsbSnoop - MyInternalIOCTLCompletion(f7940db0) : fido=84661030, Irp=845ea748, Context=84405ba0, IRQL=2
[523 ms]  <<<  URB 12 coming back  <<< 
-- URB_FUNCTION_BULK_OR_INTERRUPT_TRANSFER:
  PipeHandle           = 8469e8d4 [endpoint 0x00000003]
  TransferFlags        = 00000002 (USBD_TRANSFER_DIRECTION_OUT, USBD_SHORT_TRANSFER_OK)
  TransferBufferLength = 000003e0
  TransferBuffer       = f7b90790
  TransferBufferMDL    = 845d46b8
  UrbLink              = 00000000
[524 ms] UsbSnoop - DispatchAny(f793f610) : IRP_MJ_INTERNAL_DEVICE_CONTROL
[524 ms] UsbSnoop - MyDispatchInternalIOCTL(f7940e80) : fdo=8476dba8, Irp=845ea748, IRQL=0
[524 ms]  >>>  URB 13 going down  >>> 
-- URB_FUNCTION_BULK_OR_INTERRUPT_TRANSFER:
  PipeHandle           = 8469e8d4 [endpoint 0x00000003]
  TransferFlags        = 00000002 (USBD_TRANSFER_DIRECTION_OUT, USBD_SHORT_TRANSFER_OK)
  TransferBufferLength = 000003e0
  TransferBuffer       = f7ba7790
  TransferBufferMDL    = 00000000
    00000000: 03 00 00 00 00 00 00 00 00 00 00 00 00 00 00 00
    00000010: 00 00 00 00 00 00 00 00 00 00 00 00 00 00 00 00
    00000020: 00 f0 08 08 08 08 10 00 80 40 40 40 80 00 c0 00
    00000030: 00 00 c0 00 c0 80 40 40 80 00 f0 40 00 80 40 40
    00000040: 40 f8 00 80 40 40 40 80 00 c0 00 00 c0 00 00 c0
    00000050: 00 c0 80 40 40 80 00 00 00 00 00 00 00 00 00 00
    00000060: 00 00 00 00 00 00 00 00 00 00 00 00 00 00 00 00
    00000070: 00 00 00 00 00 00 00 00 00 00 00 00 00 00 00 00
    00000080: 00 00 00 00 00 00 00 00 00 00 00 00 00 00 70 88
    00000090: 88 88 10 00 00 f0 40 00 80 40 40 40 80 00 c0 40
    000000a0: 40 40 80 00 c0 00 00 c0 00 00 c0 00 00 40 40 40
    000000b0: 80 00 f0 40 00 80 40 40 40 80 00 f8 80 40 40 80
    000000c0: 00 07 08 08 08 08 04 00 07 08 08 08 07 00 07 08
    000000d0: 08 04 0f 00 0f 00 00 00 0f 00 07 08 00 07 08 08
    000000e0: 08 0f 00 07 08 08 08 07 00 03 0c 03 00 03 0c 03
    000000f0: 00 0f 00 00 00 0f 00 00 00 00 00 00 00 00 00 00
    00000100: 00 00 00 00 00 00 00 00 00 00 00 00 00 00 00 00
    00000110: 00 00 00 00 00 00 00 00 00 00 00 00 00 00 00 00
    00000120: 00 00 00 00 00 00 00 00 00 00 00 00 00 00 04 08
    00000130: 08 08 07 00 00 07 08 00 07 08 08 08 07 00 3f 08
    00000140: 08 08 07 00 03 0c 03 00 03 0c 03 00 06 09 09 09
    00000150: 0f 00 07 08 00 07 08 08 08 04 00 0f 00 00 00 0f
    00000160: 00 80 e0 70 10 10 70 e0 80 00 00 80 e0 70 10 10
    00000170: 70 e0 80 00 00 00 00 00 00 00 80 e0 70 10 10 70
    00000180: e0 80 00 00 f0 f0 10 10 10 10 10 10 00 00 00 00
    00000190: 00 00 00 80 e0 70 10 10 70 e0 80 00 00 80 e0 70
    000001a0: 10 10 70 e0 80 00 00 00 00 00 00 00 00 00 00 00
    000001b0: 00 00 00 00 00 00 00 00 00 00 00 80 e0 70 10 10
    000001c0: 70 e0 80 00 00 80 e0 70 10 10 70 e0 80 00 00 00
    000001d0: 00 00 00 00 80 e0 70 10 10 70 e0 80 00 00 80 e0
    000001e0: 70 10 10 70 e0 80 00 00 00 00 00 00 00 80 e0 70
    000001f0: 10 10 70 e0 80 00 00 80 e0 70 10 10 70 e0 80 00
    00000200: 00 1f 7f e0 80 80 e0 7f 1f 00 00 1f 7f e0 80 80
    00000210: e0 7f 1f 00 00 81 81 00 00 00 1f 7f e0 80 80 e0
    00000220: 7f 1f 00 00 23 63 c3 81 81 c3 7e 3c 00 00 81 81
    00000230: 00 00 00 1f 7f e0 80 80 e0 7f 1f 00 00 1f 7f e0
    00000240: 80 80 e0 7f 1f 00 00 00 00 00 00 00 00 00 00 00
    00000250: 00 00 00 00 00 00 00 00 00 00 00 1f 7f e0 80 80
    00000260: e0 7f 1f 00 00 1f 7f e0 80 80 e0 7f 1f 00 00 81
    00000270: 81 00 00 00 1f 7f e0 80 80 e0 7f 1f 00 00 1f 7f
    00000280: e0 80 80 e0 7f 1f 00 00 81 81 00 00 00 1f 7f e0
    00000290: 80 80 e0 7f 1f 00 00 1f 7f e0 80 80 e0 7f 1f 00
    000002a0: 00 00 00 00 00 00 00 00 00 00 00 00 00 00 f8 f0
    000002b0: f0 e0 e0 c0 40 00 00 00 00 00 00 00 00 00 00 00
    000002c0: 00 00 00 00 00 00 00 00 00 00 00 f8 f8 40 e0 f0
    000002d0: f8 00 00 00 00 00 00 00 00 00 00 00 00 00 00 00
    000002e0: 00 00 00 00 00 00 00 00 00 00 00 00 00 00 00 00
    000002f0: 00 00 00 00 00 00 00 00 00 00 00 00 00 00 00 00
    00000300: 00 00 00 00 00 00 00 00 00 00 00 00 00 00 00 00
    00000310: f8 f0 f0 e0 e0 c0 40 00 00 00 00 00 00 00 00 00
    00000320: 00 00 00 00 00 00 00 00 00 00 00 00 00 f8 f8 40
    00000330: e0 f0 f8 00 00 00 00 00 00 00 00 00 00 00 00 00
    00000340: 00 00 00 00 00 00 00 00 00 00 00 00 00 00 03 03
    00000350: 01 01 00 00 00 00 00 00 00 00 00 00 00 00 00 00
    00000360: 00 00 00 00 00 00 00 00 00 00 00 03 03 00 00 01
    00000370: 03 00 00 00 00 00 00 00 00 00 00 00 00 00 00 00
    00000380: 00 00 00 00 00 00 00 00 00 00 00 00 00 00 00 00
    00000390: 00 00 00 00 00 00 00 00 00 00 00 00 00 00 00 00
    000003a0: 00 00 00 00 00 00 00 00 00 00 00 00 00 00 00 00
    000003b0: 03 03 01 01 00 00 00 00 00 00 00 00 00 00 00 00
    000003c0: 00 00 00 00 00 00 00 00 00 00 00 00 00 03 03 00
    000003d0: 00 01 03 00 00 00 00 00 00 00 00 00 00 00 00 00
  UrbLink              = 00000000
[603 ms] UsbSnoop - MyInternalIOCTLCompletion(f7940db0) : fido=84661030, Irp=845ea748, Context=847668d8, IRQL=2
[603 ms]  <<<  URB 13 coming back  <<< 
-- URB_FUNCTION_BULK_OR_INTERRUPT_TRANSFER:
  PipeHandle           = 8469e8d4 [endpoint 0x00000003]
  TransferFlags        = 00000002 (USBD_TRANSFER_DIRECTION_OUT, USBD_SHORT_TRANSFER_OK)
  TransferBufferLength = 000003e0
  TransferBuffer       = f7ba7790
  TransferBufferMDL    = 845d46b8
  UrbLink              = 00000000
[53924 ms] UsbSnoop - DispatchAny(f793f610) : IRP_MJ_INTERNAL_DEVICE_CONTROL
[53924 ms] UsbSnoop - MyDispatchInternalIOCTL(f7940e80) : fdo=8476dba8, Irp=843dae00, IRQL=0
[53924 ms]  >>>  URB 14 going down  >>> 
-- URB_FUNCTION_CLASS_INTERFACE:
  TransferFlags          = 00000000 (USBD_TRANSFER_DIRECTION_OUT, ~USBD_SHORT_TRANSFER_OK)
  TransferBufferLength = 00000004
  TransferBuffer       = 844b0c30
  TransferBufferMDL    = 00000000
    00000000: 02 02 20 00
  UrbLink                 = 00000000
  RequestTypeReservedBits = 00000022
  Request                 = 00000009
  Value                   = 00000302
  Index                   = 00000002
[53938 ms] UsbSnoop - MyInternalIOCTLCompletion(f7940db0) : fido=84661030, Irp=843dae00, Context=8476feb0, IRQL=2
[53938 ms]  <<<  URB 14 coming back  <<< 
-- URB_FUNCTION_CONTROL_TRANSFER:
  PipeHandle           = 84406ed8
  TransferFlags        = 0000000a (USBD_TRANSFER_DIRECTION_OUT, USBD_SHORT_TRANSFER_OK)
  TransferBufferLength = 00000004
  TransferBuffer       = 844b0c30
  TransferBufferMDL    = 8451b128
  UrbLink              = 00000000
  SetupPacket          =
    00000000: 21 09 02 03 02 00 04 00
[53974 ms] UsbSnoop - DispatchAny(f793f610) : IRP_MJ_INTERNAL_DEVICE_CONTROL
[53974 ms] UsbSnoop - MyDispatchInternalIOCTL(f7940e80) : fdo=8476dba8, Irp=84748368, IRQL=0
[53974 ms]  >>>  URB 15 going down  >>> 
-- URB_FUNCTION_CLASS_INTERFACE:
  TransferFlags          = 00000000 (USBD_TRANSFER_DIRECTION_OUT, ~USBD_SHORT_TRANSFER_OK)
  TransferBufferLength = 00000004
  TransferBuffer       = 844b0c30
  TransferBufferMDL    = 00000000
    00000000: 02 02 20 00
  UrbLink                 = 00000000
  RequestTypeReservedBits = 00000022
  Request                 = 00000009
  Value                   = 00000302
  Index                   = 00000002
[53987 ms] UsbSnoop - MyInternalIOCTLCompletion(f7940db0) : fido=84661030, Irp=84748368, Context=844eed60, IRQL=2
[53987 ms]  <<<  URB 15 coming back  <<< 
-- URB_FUNCTION_CONTROL_TRANSFER:
  PipeHandle           = 84406ed8
  TransferFlags        = 0000000a (USBD_TRANSFER_DIRECTION_OUT, USBD_SHORT_TRANSFER_OK)
  TransferBufferLength = 00000004
  TransferBuffer       = 844b0c30
  TransferBufferMDL    = 844b6ae0
  UrbLink              = 00000000
  SetupPacket          =
    00000000: 21 09 02 03 02 00 04 00
[54025 ms] UsbSnoop - DispatchAny(f793f610) : IRP_MJ_INTERNAL_DEVICE_CONTROL
[54025 ms] UsbSnoop - MyDispatchInternalIOCTL(f7940e80) : fdo=8476dba8, Irp=843dae00, IRQL=0
[54025 ms]  >>>  URB 16 going down  >>> 
-- URB_FUNCTION_CLASS_INTERFACE:
  TransferFlags          = 00000000 (USBD_TRANSFER_DIRECTION_OUT, ~USBD_SHORT_TRANSFER_OK)
  TransferBufferLength = 00000004
  TransferBuffer       = 844b0c30
  TransferBufferMDL    = 00000000
    00000000: 02 20 81 00
  UrbLink                 = 00000000
  RequestTypeReservedBits = 00000022
  Request                 = 00000009
  Value                   = 00000302
  Index                   = 00000002
[54038 ms] UsbSnoop - MyInternalIOCTLCompletion(f7940db0) : fido=84661030, Irp=843dae00, Context=84499238, IRQL=2
[54038 ms]  <<<  URB 16 coming back  <<< 
-- URB_FUNCTION_CONTROL_TRANSFER:
  PipeHandle           = 84406ed8
  TransferFlags        = 0000000a (USBD_TRANSFER_DIRECTION_OUT, USBD_SHORT_TRANSFER_OK)
  TransferBufferLength = 00000004
  TransferBuffer       = 844b0c30
  TransferBufferMDL    = 844b6ae0
  UrbLink              = 00000000
  SetupPacket          =
    00000000: 21 09 02 03 02 00 04 00
[54070 ms] UsbSnoop - DispatchAny(f793f610) : IRP_MJ_INTERNAL_DEVICE_CONTROL
[54070 ms] UsbSnoop - MyDispatchInternalIOCTL(f7940e80) : fdo=8476dba8, Irp=84748368, IRQL=0
[54070 ms]  >>>  URB 17 going down  >>> 
-- URB_FUNCTION_CLASS_INTERFACE:
  TransferFlags          = 00000000 (USBD_TRANSFER_DIRECTION_OUT, ~USBD_SHORT_TRANSFER_OK)
  TransferBufferLength = 00000004
  TransferBuffer       = 844b0c30
  TransferBufferMDL    = 00000000
    00000000: 02 02 00 00
  UrbLink                 = 00000000
  RequestTypeReservedBits = 00000022
  Request                 = 00000009
  Value                   = 00000302
  Index                   = 00000002
[54083 ms] UsbSnoop - MyInternalIOCTLCompletion(f7940db0) : fido=84661030, Irp=84748368, Context=84499238, IRQL=2
[54083 ms]  <<<  URB 17 coming back  <<< 
-- URB_FUNCTION_CONTROL_TRANSFER:
  PipeHandle           = 84406ed8
  TransferFlags        = 0000000a (USBD_TRANSFER_DIRECTION_OUT, USBD_SHORT_TRANSFER_OK)
  TransferBufferLength = 00000004
  TransferBuffer       = 844b0c30
  TransferBufferMDL    = 844b6ae0
  UrbLink              = 00000000
  SetupPacket          =
    00000000: 21 09 02 03 02 00 04 00
[54114 ms] UsbSnoop - DispatchAny(f793f610) : IRP_MJ_INTERNAL_DEVICE_CONTROL
[54114 ms] UsbSnoop - MyDispatchInternalIOCTL(f7940e80) : fdo=8476dba8, Irp=843dae00, IRQL=0
[54114 ms]  >>>  URB 18 going down  >>> 
-- URB_FUNCTION_CLASS_INTERFACE:
  TransferFlags          = 00000000 (USBD_TRANSFER_DIRECTION_OUT, ~USBD_SHORT_TRANSFER_OK)
  TransferBufferLength = 00000004
  TransferBuffer       = 844b0c30
  TransferBufferMDL    = 00000000
    00000000: 02 02 00 00
  UrbLink                 = 00000000
  RequestTypeReservedBits = 00000022
  Request                 = 00000009
  Value                   = 00000302
  Index                   = 00000002
[54127 ms] UsbSnoop - MyInternalIOCTLCompletion(f7940db0) : fido=84661030, Irp=843dae00, Context=84499238, IRQL=2
[54128 ms]  <<<  URB 18 coming back  <<< 
-- URB_FUNCTION_CONTROL_TRANSFER:
  PipeHandle           = 84406ed8
  TransferFlags        = 0000000a (USBD_TRANSFER_DIRECTION_OUT, USBD_SHORT_TRANSFER_OK)
  TransferBufferLength = 00000004
  TransferBuffer       = 844b0c30
  TransferBufferMDL    = 8451b128
  UrbLink              = 00000000
  SetupPacket          =
    00000000: 21 09 02 03 02 00 04 00
[54165 ms] UsbSnoop - DispatchAny(f793f610) : IRP_MJ_INTERNAL_DEVICE_CONTROL
[54165 ms] UsbSnoop - MyDispatchInternalIOCTL(f7940e80) : fdo=8476dba8, Irp=843dae00, IRQL=0
[54165 ms]  >>>  URB 19 going down  >>> 
-- URB_FUNCTION_CLASS_INTERFACE:
  TransferFlags          = 00000000 (USBD_TRANSFER_DIRECTION_OUT, ~USBD_SHORT_TRANSFER_OK)
  TransferBufferLength = 00000004
  TransferBuffer       = 844b0c30
  TransferBufferMDL    = 00000000
    00000000: 02 20 81 00
  UrbLink                 = 00000000
  RequestTypeReservedBits = 00000022
  Request                 = 00000009
  Value                   = 00000302
  Index                   = 00000002
[54178 ms] UsbSnoop - MyInternalIOCTLCompletion(f7940db0) : fido=84661030, Irp=843dae00, Context=8476feb0, IRQL=2
[54178 ms]  <<<  URB 19 coming back  <<< 
-- URB_FUNCTION_CONTROL_TRANSFER:
  PipeHandle           = 84406ed8
  TransferFlags        = 0000000a (USBD_TRANSFER_DIRECTION_OUT, USBD_SHORT_TRANSFER_OK)
  TransferBufferLength = 00000004
  TransferBuffer       = 844b0c30
  TransferBufferMDL    = 8451b128
  UrbLink              = 00000000
  SetupPacket          =
    00000000: 21 09 02 03 02 00 04 00
[54213 ms] UsbSnoop - DispatchAny(f793f610) : IRP_MJ_INTERNAL_DEVICE_CONTROL
[54213 ms] UsbSnoop - MyDispatchInternalIOCTL(f7940e80) : fdo=8476dba8, Irp=843dae00, IRQL=0
[54213 ms]  >>>  URB 20 going down  >>> 
-- URB_FUNCTION_CLASS_INTERFACE:
  TransferFlags          = 00000000 (USBD_TRANSFER_DIRECTION_OUT, ~USBD_SHORT_TRANSFER_OK)
  TransferBufferLength = 00000004
  TransferBuffer       = 844b0c30
  TransferBufferMDL    = 00000000
    00000000: 02 02 20 00
  UrbLink                 = 00000000
  RequestTypeReservedBits = 00000022
  Request                 = 00000009
  Value                   = 00000302
  Index                   = 00000002
[54228 ms] UsbSnoop - MyInternalIOCTLCompletion(f7940db0) : fido=84661030, Irp=843dae00, Context=8461a8f0, IRQL=2
[54228 ms]  <<<  URB 20 coming back  <<< 
-- URB_FUNCTION_CONTROL_TRANSFER:
  PipeHandle           = 84406ed8
  TransferFlags        = 0000000a (USBD_TRANSFER_DIRECTION_OUT, USBD_SHORT_TRANSFER_OK)
  TransferBufferLength = 00000004
  TransferBuffer       = 844b0c30
  TransferBufferMDL    = 8451b128
  UrbLink              = 00000000
  SetupPacket          =
    00000000: 21 09 02 03 02 00 04 00
[54264 ms] UsbSnoop - DispatchAny(f793f610) : IRP_MJ_INTERNAL_DEVICE_CONTROL
[54264 ms] UsbSnoop - MyDispatchInternalIOCTL(f7940e80) : fdo=8476dba8, Irp=843da9f0, IRQL=0
[54264 ms]  >>>  URB 21 going down  >>> 
-- URB_FUNCTION_CLASS_INTERFACE:
  TransferFlags          = 00000000 (USBD_TRANSFER_DIRECTION_OUT, ~USBD_SHORT_TRANSFER_OK)
  TransferBufferLength = 00000004
  TransferBuffer       = 844b0c30
  TransferBufferMDL    = 00000000
    00000000: 02 02 20 00
  UrbLink                 = 00000000
  RequestTypeReservedBits = 00000022
  Request                 = 00000009
  Value                   = 00000302
  Index                   = 00000002
[54279 ms] UsbSnoop - MyInternalIOCTLCompletion(f7940db0) : fido=84661030, Irp=843da9f0, Context=84499238, IRQL=2
[54279 ms]  <<<  URB 21 coming back  <<< 
-- URB_FUNCTION_CONTROL_TRANSFER:
  PipeHandle           = 84406ed8
  TransferFlags        = 0000000a (USBD_TRANSFER_DIRECTION_OUT, USBD_SHORT_TRANSFER_OK)
  TransferBufferLength = 00000004
  TransferBuffer       = 844b0c30
  TransferBufferMDL    = 8451b128
  UrbLink              = 00000000
  SetupPacket          =
    00000000: 21 09 02 03 02 00 04 00
[54314 ms] UsbSnoop - DispatchAny(f793f610) : IRP_MJ_INTERNAL_DEVICE_CONTROL
[54314 ms] UsbSnoop - MyDispatchInternalIOCTL(f7940e80) : fdo=8476dba8, Irp=84757760, IRQL=0
[54314 ms]  >>>  URB 22 going down  >>> 
-- URB_FUNCTION_CLASS_INTERFACE:
  TransferFlags          = 00000000 (USBD_TRANSFER_DIRECTION_OUT, ~USBD_SHORT_TRANSFER_OK)
  TransferBufferLength = 00000004
  TransferBuffer       = 844b0c30
  TransferBufferMDL    = 00000000
    00000000: 02 20 81 00
  UrbLink                 = 00000000
  RequestTypeReservedBits = 00000022
  Request                 = 00000009
  Value                   = 00000302
  Index                   = 00000002
[54329 ms] UsbSnoop - MyInternalIOCTLCompletion(f7940db0) : fido=84661030, Irp=84757760, Context=8476feb0, IRQL=2
[54329 ms]  <<<  URB 22 coming back  <<< 
-- URB_FUNCTION_CONTROL_TRANSFER:
  PipeHandle           = 84406ed8
  TransferFlags        = 0000000a (USBD_TRANSFER_DIRECTION_OUT, USBD_SHORT_TRANSFER_OK)
  TransferBufferLength = 00000004
  TransferBuffer       = 844b0c30
  TransferBufferMDL    = 8451b128
  UrbLink              = 00000000
  SetupPacket          =
    00000000: 21 09 02 03 02 00 04 00
[54367 ms] UsbSnoop - DispatchAny(f793f610) : IRP_MJ_INTERNAL_DEVICE_CONTROL
[54367 ms] UsbSnoop - MyDispatchInternalIOCTL(f7940e80) : fdo=8476dba8, Irp=843dae00, IRQL=0
[54367 ms]  >>>  URB 23 going down  >>> 
-- URB_FUNCTION_CLASS_INTERFACE:
  TransferFlags          = 00000000 (USBD_TRANSFER_DIRECTION_OUT, ~USBD_SHORT_TRANSFER_OK)
  TransferBufferLength = 00000004
  TransferBuffer       = 844b0c30
  TransferBufferMDL    = 00000000
    00000000: 02 02 00 00
  UrbLink                 = 00000000
  RequestTypeReservedBits = 00000022
  Request                 = 00000009
  Value                   = 00000302
  Index                   = 00000002
[54380 ms] UsbSnoop - MyInternalIOCTLCompletion(f7940db0) : fido=84661030, Irp=843dae00, Context=843a3940, IRQL=2
[54380 ms]  <<<  URB 23 coming back  <<< 
-- URB_FUNCTION_CONTROL_TRANSFER:
  PipeHandle           = 84406ed8
  TransferFlags        = 0000000a (USBD_TRANSFER_DIRECTION_OUT, USBD_SHORT_TRANSFER_OK)
  TransferBufferLength = 00000004
  TransferBuffer       = 844b0c30
  TransferBufferMDL    = 844b6ae0
  UrbLink              = 00000000
  SetupPacket          =
    00000000: 21 09 02 03 02 00 04 00
[54415 ms] UsbSnoop - DispatchAny(f793f610) : IRP_MJ_INTERNAL_DEVICE_CONTROL
[54415 ms] UsbSnoop - MyDispatchInternalIOCTL(f7940e80) : fdo=8476dba8, Irp=84748368, IRQL=0
[54415 ms]  >>>  URB 24 going down  >>> 
-- URB_FUNCTION_CLASS_INTERFACE:
  TransferFlags          = 00000000 (USBD_TRANSFER_DIRECTION_OUT, ~USBD_SHORT_TRANSFER_OK)
  TransferBufferLength = 00000004
  TransferBuffer       = 844b0c30
  TransferBufferMDL    = 00000000
    00000000: 02 02 00 00
  UrbLink                 = 00000000
  RequestTypeReservedBits = 00000022
  Request                 = 00000009
  Value                   = 00000302
  Index                   = 00000002
[54430 ms] UsbSnoop - MyInternalIOCTLCompletion(f7940db0) : fido=84661030, Irp=84748368, Context=843a3940, IRQL=2
[54430 ms]  <<<  URB 24 coming back  <<< 
-- URB_FUNCTION_CONTROL_TRANSFER:
  PipeHandle           = 84406ed8
  TransferFlags        = 0000000a (USBD_TRANSFER_DIRECTION_OUT, USBD_SHORT_TRANSFER_OK)
  TransferBufferLength = 00000004
  TransferBuffer       = 844b0c30
  TransferBufferMDL    = 8451b128
  UrbLink              = 00000000
  SetupPacket          =
    00000000: 21 09 02 03 02 00 04 00
[54466 ms] UsbSnoop - DispatchAny(f793f610) : IRP_MJ_INTERNAL_DEVICE_CONTROL
[54466 ms] UsbSnoop - MyDispatchInternalIOCTL(f7940e80) : fdo=8476dba8, Irp=84748368, IRQL=0
[54466 ms]  >>>  URB 25 going down  >>> 
-- URB_FUNCTION_CLASS_INTERFACE:
  TransferFlags          = 00000000 (USBD_TRANSFER_DIRECTION_OUT, ~USBD_SHORT_TRANSFER_OK)
  TransferBufferLength = 00000004
  TransferBuffer       = 844b0c30
  TransferBufferMDL    = 00000000
    00000000: 02 20 81 00
  UrbLink                 = 00000000
  RequestTypeReservedBits = 00000022
  Request                 = 00000009
  Value                   = 00000302
  Index                   = 00000002
[54481 ms] UsbSnoop - MyInternalIOCTLCompletion(f7940db0) : fido=84661030, Irp=84748368, Context=8461a8f0, IRQL=2
[54481 ms]  <<<  URB 25 coming back  <<< 
-- URB_FUNCTION_CONTROL_TRANSFER:
  PipeHandle           = 84406ed8
  TransferFlags        = 0000000a (USBD_TRANSFER_DIRECTION_OUT, USBD_SHORT_TRANSFER_OK)
  TransferBufferLength = 00000004
  TransferBuffer       = 844b0c30
  TransferBufferMDL    = 8451b128
  UrbLink              = 00000000
  SetupPacket          =
    00000000: 21 09 02 03 02 00 04 00
[54511 ms] UsbSnoop - DispatchAny(f793f610) : IRP_MJ_INTERNAL_DEVICE_CONTROL
[54511 ms] UsbSnoop - MyDispatchInternalIOCTL(f7940e80) : fdo=8476dba8, Irp=843dae00, IRQL=0
[54511 ms]  >>>  URB 26 going down  >>> 
-- URB_FUNCTION_CLASS_INTERFACE:
  TransferFlags          = 00000000 (USBD_TRANSFER_DIRECTION_OUT, ~USBD_SHORT_TRANSFER_OK)
  TransferBufferLength = 00000004
  TransferBuffer       = 844b0c30
  TransferBufferMDL    = 00000000
    00000000: 02 02 10 00
  UrbLink                 = 00000000
  RequestTypeReservedBits = 00000022
  Request                 = 00000009
  Value                   = 00000302
  Index                   = 00000002
[54526 ms] UsbSnoop - MyInternalIOCTLCompletion(f7940db0) : fido=84661030, Irp=843dae00, Context=843a3940, IRQL=2
[54526 ms]  <<<  URB 26 coming back  <<< 
-- URB_FUNCTION_CONTROL_TRANSFER:
  PipeHandle           = 84406ed8
  TransferFlags        = 0000000a (USBD_TRANSFER_DIRECTION_OUT, USBD_SHORT_TRANSFER_OK)
  TransferBufferLength = 00000004
  TransferBuffer       = 844b0c30
  TransferBufferMDL    = 844b6ae0
  UrbLink              = 00000000
  SetupPacket          =
    00000000: 21 09 02 03 02 00 04 00
[54565 ms] UsbSnoop - DispatchAny(f793f610) : IRP_MJ_INTERNAL_DEVICE_CONTROL
[54565 ms] UsbSnoop - MyDispatchInternalIOCTL(f7940e80) : fdo=8476dba8, Irp=843dae00, IRQL=0
[54565 ms]  >>>  URB 27 going down  >>> 
-- URB_FUNCTION_CLASS_INTERFACE:
  TransferFlags          = 00000000 (USBD_TRANSFER_DIRECTION_OUT, ~USBD_SHORT_TRANSFER_OK)
  TransferBufferLength = 00000004
  TransferBuffer       = 844b0c30
  TransferBufferMDL    = 00000000
    00000000: 02 02 10 00
  UrbLink                 = 00000000
  RequestTypeReservedBits = 00000022
  Request                 = 00000009
  Value                   = 00000302
  Index                   = 00000002
[54577 ms] UsbSnoop - MyInternalIOCTLCompletion(f7940db0) : fido=84661030, Irp=843dae00, Context=8476feb0, IRQL=2
[54577 ms]  <<<  URB 27 coming back  <<< 
-- URB_FUNCTION_CONTROL_TRANSFER:
  PipeHandle           = 84406ed8
  TransferFlags        = 0000000a (USBD_TRANSFER_DIRECTION_OUT, USBD_SHORT_TRANSFER_OK)
  TransferBufferLength = 00000004
  TransferBuffer       = 844b0c30
  TransferBufferMDL    = 8451b128
  UrbLink              = 00000000
  SetupPacket          =
    00000000: 21 09 02 03 02 00 04 00
[54615 ms] UsbSnoop - DispatchAny(f793f610) : IRP_MJ_INTERNAL_DEVICE_CONTROL
[54615 ms] UsbSnoop - MyDispatchInternalIOCTL(f7940e80) : fdo=8476dba8, Irp=843dae00, IRQL=0
[54615 ms]  >>>  URB 28 going down  >>> 
-- URB_FUNCTION_CLASS_INTERFACE:
  TransferFlags          = 00000000 (USBD_TRANSFER_DIRECTION_OUT, ~USBD_SHORT_TRANSFER_OK)
  TransferBufferLength = 00000004
  TransferBuffer       = 844b0c30
  TransferBufferMDL    = 00000000
    00000000: 02 20 81 00
  UrbLink                 = 00000000
  RequestTypeReservedBits = 00000022
  Request                 = 00000009
  Value                   = 00000302
  Index                   = 00000002
[54626 ms] UsbSnoop - MyInternalIOCTLCompletion(f7940db0) : fido=84661030, Irp=843dae00, Context=84499238, IRQL=2
[54626 ms]  <<<  URB 28 coming back  <<< 
-- URB_FUNCTION_CONTROL_TRANSFER:
  PipeHandle           = 84406ed8
  TransferFlags        = 0000000a (USBD_TRANSFER_DIRECTION_OUT, USBD_SHORT_TRANSFER_OK)
  TransferBufferLength = 00000004
  TransferBuffer       = 844b0c30
  TransferBufferMDL    = 8451b128
  UrbLink              = 00000000
  SetupPacket          =
    00000000: 21 09 02 03 02 00 04 00
[54661 ms] UsbSnoop - DispatchAny(f793f610) : IRP_MJ_INTERNAL_DEVICE_CONTROL
[54661 ms] UsbSnoop - MyDispatchInternalIOCTL(f7940e80) : fdo=8476dba8, Irp=8437cbf8, IRQL=0
[54661 ms]  >>>  URB 29 going down  >>> 
-- URB_FUNCTION_CLASS_INTERFACE:
  TransferFlags          = 00000000 (USBD_TRANSFER_DIRECTION_OUT, ~USBD_SHORT_TRANSFER_OK)
  TransferBufferLength = 00000004
  TransferBuffer       = 844b0c30
  TransferBufferMDL    = 00000000
    00000000: 02 02 10 00
  UrbLink                 = 00000000
  RequestTypeReservedBits = 00000022
  Request                 = 00000009
  Value                   = 00000302
  Index                   = 00000002
[54678 ms] UsbSnoop - MyInternalIOCTLCompletion(f7940db0) : fido=84661030, Irp=8437cbf8, Context=84499238, IRQL=2
[54678 ms]  <<<  URB 29 coming back  <<< 
-- URB_FUNCTION_CONTROL_TRANSFER:
  PipeHandle           = 84406ed8
  TransferFlags        = 0000000a (USBD_TRANSFER_DIRECTION_OUT, USBD_SHORT_TRANSFER_OK)
  TransferBufferLength = 00000004
  TransferBuffer       = 844b0c30
  TransferBufferMDL    = 844b6ae0
  UrbLink              = 00000000
  SetupPacket          =
    00000000: 21 09 02 03 02 00 04 00
[54715 ms] UsbSnoop - DispatchAny(f793f610) : IRP_MJ_INTERNAL_DEVICE_CONTROL
[54715 ms] UsbSnoop - MyDispatchInternalIOCTL(f7940e80) : fdo=8476dba8, Irp=8437cbf8, IRQL=0
[54715 ms]  >>>  URB 30 going down  >>> 
-- URB_FUNCTION_CLASS_INTERFACE:
  TransferFlags          = 00000000 (USBD_TRANSFER_DIRECTION_OUT, ~USBD_SHORT_TRANSFER_OK)
  TransferBufferLength = 00000004
  TransferBuffer       = 844b0c30
  TransferBufferMDL    = 00000000
    00000000: 02 02 10 00
  UrbLink                 = 00000000
  RequestTypeReservedBits = 00000022
  Request                 = 00000009
  Value                   = 00000302
  Index                   = 00000002
[54728 ms] UsbSnoop - MyInternalIOCTLCompletion(f7940db0) : fido=84661030, Irp=8437cbf8, Context=843a3940, IRQL=2
[54728 ms]  <<<  URB 30 coming back  <<< 
-- URB_FUNCTION_CONTROL_TRANSFER:
  PipeHandle           = 84406ed8
  TransferFlags        = 0000000a (USBD_TRANSFER_DIRECTION_OUT, USBD_SHORT_TRANSFER_OK)
  TransferBufferLength = 00000004
  TransferBuffer       = 844b0c30
  TransferBufferMDL    = 844b6ae0
  UrbLink              = 00000000
  SetupPacket          =
    00000000: 21 09 02 03 02 00 04 00
[54766 ms] UsbSnoop - DispatchAny(f793f610) : IRP_MJ_INTERNAL_DEVICE_CONTROL
[54766 ms] UsbSnoop - MyDispatchInternalIOCTL(f7940e80) : fdo=8476dba8, Irp=8437cbf8, IRQL=0
[54766 ms]  >>>  URB 31 going down  >>> 
-- URB_FUNCTION_CLASS_INTERFACE:
  TransferFlags          = 00000000 (USBD_TRANSFER_DIRECTION_OUT, ~USBD_SHORT_TRANSFER_OK)
  TransferBufferLength = 00000004
  TransferBuffer       = 844b0c30
  TransferBufferMDL    = 00000000
    00000000: 02 20 81 00
  UrbLink                 = 00000000
  RequestTypeReservedBits = 00000022
  Request                 = 00000009
  Value                   = 00000302
  Index                   = 00000002
[54784 ms] UsbSnoop - MyInternalIOCTLCompletion(f7940db0) : fido=84661030, Irp=8437cbf8, Context=8461a8f0, IRQL=2
[54784 ms]  <<<  URB 31 coming back  <<< 
-- URB_FUNCTION_CONTROL_TRANSFER:
  PipeHandle           = 84406ed8
  TransferFlags        = 0000000a (USBD_TRANSFER_DIRECTION_OUT, USBD_SHORT_TRANSFER_OK)
  TransferBufferLength = 00000004
  TransferBuffer       = 844b0c30
  TransferBufferMDL    = 844b6ae0
  UrbLink              = 00000000
  SetupPacket          =
    00000000: 21 09 02 03 02 00 04 00
[66259 ms] UsbSnoop - DispatchAny(f793f610) : IRP_MJ_INTERNAL_DEVICE_CONTROL
[66259 ms] UsbSnoop - MyDispatchInternalIOCTL(f7940e80) : fdo=8476dba8, Irp=8461a008, IRQL=0
[66259 ms]  >>>  URB 32 going down  >>> 
-- URB_FUNCTION_CLASS_INTERFACE:
  TransferFlags          = 00000000 (USBD_TRANSFER_DIRECTION_OUT, ~USBD_SHORT_TRANSFER_OK)
  TransferBufferLength = 00000004
  TransferBuffer       = 844b0c30
  TransferBufferMDL    = 00000000
    00000000: 02 02 10 00
  UrbLink                 = 00000000
  RequestTypeReservedBits = 00000022
  Request                 = 00000009
  Value                   = 00000302
  Index                   = 00000002
[66274 ms] UsbSnoop - MyInternalIOCTLCompletion(f7940db0) : fido=84661030, Irp=8461a008, Context=8476feb0, IRQL=2
[66274 ms]  <<<  URB 32 coming back  <<< 
-- URB_FUNCTION_CONTROL_TRANSFER:
  PipeHandle           = 84406ed8
  TransferFlags        = 0000000a (USBD_TRANSFER_DIRECTION_OUT, USBD_SHORT_TRANSFER_OK)
  TransferBufferLength = 00000004
  TransferBuffer       = 844b0c30
  TransferBufferMDL    = 844b6ae0
  UrbLink              = 00000000
  SetupPacket          =
    00000000: 21 09 02 03 02 00 04 00
[66317 ms] UsbSnoop - DispatchAny(f793f610) : IRP_MJ_INTERNAL_DEVICE_CONTROL
[66317 ms] UsbSnoop - MyDispatchInternalIOCTL(f7940e80) : fdo=8476dba8, Irp=8461a008, IRQL=0
[66317 ms]  >>>  URB 33 going down  >>> 
-- URB_FUNCTION_CLASS_INTERFACE:
  TransferFlags          = 00000000 (USBD_TRANSFER_DIRECTION_OUT, ~USBD_SHORT_TRANSFER_OK)
  TransferBufferLength = 00000004
  TransferBuffer       = 844b0c30
  TransferBufferMDL    = 00000000
    00000000: 02 02 10 00
  UrbLink                 = 00000000
  RequestTypeReservedBits = 00000022
  Request                 = 00000009
  Value                   = 00000302
  Index                   = 00000002
[66333 ms] UsbSnoop - MyInternalIOCTLCompletion(f7940db0) : fido=84661030, Irp=8461a008, Context=8449f590, IRQL=2
[66333 ms]  <<<  URB 33 coming back  <<< 
-- URB_FUNCTION_CONTROL_TRANSFER:
  PipeHandle           = 84406ed8
  TransferFlags        = 0000000a (USBD_TRANSFER_DIRECTION_OUT, USBD_SHORT_TRANSFER_OK)
  TransferBufferLength = 00000004
  TransferBuffer       = 844b0c30
  TransferBufferMDL    = 844b6ae0
  UrbLink              = 00000000
  SetupPacket          =
    00000000: 21 09 02 03 02 00 04 00
[66364 ms] UsbSnoop - DispatchAny(f793f610) : IRP_MJ_INTERNAL_DEVICE_CONTROL
[66364 ms] UsbSnoop - MyDispatchInternalIOCTL(f7940e80) : fdo=8476dba8, Irp=8461a008, IRQL=0
[66364 ms]  >>>  URB 34 going down  >>> 
-- URB_FUNCTION_CLASS_INTERFACE:
  TransferFlags          = 00000000 (USBD_TRANSFER_DIRECTION_OUT, ~USBD_SHORT_TRANSFER_OK)
  TransferBufferLength = 00000004
  TransferBuffer       = 844b0c30
  TransferBufferMDL    = 00000000
    00000000: 02 20 81 00
  UrbLink                 = 00000000
  RequestTypeReservedBits = 00000022
  Request                 = 00000009
  Value                   = 00000302
  Index                   = 00000002
[66379 ms] UsbSnoop - MyInternalIOCTLCompletion(f7940db0) : fido=84661030, Irp=8461a008, Context=844992a0, IRQL=2
[66379 ms]  <<<  URB 34 coming back  <<< 
-- URB_FUNCTION_CONTROL_TRANSFER:
  PipeHandle           = 84406ed8
  TransferFlags        = 0000000a (USBD_TRANSFER_DIRECTION_OUT, USBD_SHORT_TRANSFER_OK)
  TransferBufferLength = 00000004
  TransferBuffer       = 844b0c30
  TransferBufferMDL    = 844b6ae0
  UrbLink              = 00000000
  SetupPacket          =
    00000000: 21 09 02 03 02 00 04 00
[71566 ms] UsbSnoop - MyInternalIOCTLCompletion(f7940db0) : fido=84661030, Irp=84619930, Context=84408d80, IRQL=2
[71566 ms]  <<<  URB 7 coming back  <<< 
-- URB_FUNCTION_BULK_OR_INTERRUPT_TRANSFER:
  PipeHandle           = 8469e8b4 [endpoint 0x00000083]
  TransferFlags        = 00000003 (USBD_TRANSFER_DIRECTION_IN, USBD_SHORT_TRANSFER_OK)
  TransferBufferLength = 00000000
  TransferBuffer       = 8440cd98
  TransferBufferMDL    = 845e0e38
  UrbLink              = 00000000
[71566 ms] UsbSnoop - DispatchAny(f793f610) : IRP_MJ_INTERNAL_DEVICE_CONTROL
[71566 ms] UsbSnoop - MyDispatchInternalIOCTL(f7940e80) : fdo=8476dba8, Irp=843da7e8, IRQL=0
[71566 ms] UsbSnoop - DispatchAny(f793f610) : IRP_MJ_INTERNAL_DEVICE_CONTROL
[71566 ms] UsbSnoop - MyDispatchInternalIOCTL(f7940e80) : fdo=8476dba8, Irp=843da7e8, IRQL=0
[71566 ms]  >>>  URB 35 going down  >>> 
-- URB_FUNCTION_ABORT_PIPE:
  PipeHandle = 8469e8b4 [endpoint 0x00000083]
[72063 ms] UsbSnoop - MyInternalIOCTLCompletion(f7940db0) : fido=84661030, Irp=843ddae8, Context=8453c818, IRQL=2
[72063 ms]  <<<  URB 8 coming back  <<< 
-- URB_FUNCTION_BULK_OR_INTERRUPT_TRANSFER:
  PipeHandle           = 8469e8b4 [endpoint 0x00000083]
  TransferFlags        = 00000003 (USBD_TRANSFER_DIRECTION_IN, USBD_SHORT_TRANSFER_OK)
  TransferBufferLength = 00000000
  TransferBuffer       = 847645f8
  TransferBufferMDL    = 84766968
  UrbLink              = 00000000
[72063 ms] UsbSnoop - MyInternalIOCTLCompletion(f7940db0) : fido=00000000, Irp=843da7e8, Context=845e0c10, IRQL=2
[72063 ms]  <<<  URB 35 coming back  <<< 
-- URB_FUNCTION_ABORT_PIPE:
[72063 ms] UsbSnoop - DispatchAny(f793f610) : IRP_MJ_INTERNAL_DEVICE_CONTROL
[72063 ms] UsbSnoop - MyDispatchInternalIOCTL(f7940e80) : fdo=8476dba8, Irp=843da7e8, IRQL=0
[72063 ms] UsbSnoop - DispatchAny(f793f610) : IRP_MJ_INTERNAL_DEVICE_CONTROL
[72063 ms] UsbSnoop - MyDispatchInternalIOCTL(f7940e80) : fdo=8476dba8, Irp=843da7e8, IRQL=0
[72063 ms]  >>>  URB 36 going down  >>> 
-- URB_FUNCTION_RESET_PIPE:
  PipeHandle = 8469e8b4 [endpoint 0x00000083]
[72573 ms] UsbSnoop - MyInternalIOCTLCompletion(f7940db0) : fido=00000000, Irp=843da7e8, Context=84599d30, IRQL=0
[72573 ms]  <<<  URB 36 coming back  <<< 
-- URB_FUNCTION_RESET_PIPE:
[72616 ms] UsbSnoop - DispatchAny(f793f610) : IRP_MJ_PNP (IRP_MN_QUERY_DEVICE_RELATIONS)
[72616 ms] UsbSnoop - MyDispatchPNP(f7941ee0) : IRP_MJ_PNP (IRP_MN_QUERY_DEVICE_RELATIONS)
[72616 ms] UsbSnoop - DispatchAny(f793f610) : IRP_MJ_PNP (IRP_MN_QUERY_DEVICE_RELATIONS)
[72616 ms] UsbSnoop - MyDispatchPNP(f7941ee0) : IRP_MJ_PNP (IRP_MN_QUERY_DEVICE_RELATIONS)
[73065 ms] UsbSnoop - DispatchAny(f793f610) : IRP_MJ_INTERNAL_DEVICE_CONTROL
[73065 ms] UsbSnoop - MyDispatchInternalIOCTL(f7940e80) : fdo=8476dba8, Irp=843ddae8, IRQL=2
[73065 ms]  >>>  URB 37 going down  >>> 
-- URB_FUNCTION_BULK_OR_INTERRUPT_TRANSFER:
  PipeHandle           = 8469e8b4 [endpoint 0x00000083]
  TransferFlags        = 00000003 (USBD_TRANSFER_DIRECTION_IN, USBD_SHORT_TRANSFER_OK)
  TransferBufferLength = 00000009
  TransferBuffer       = 847645f8
  TransferBufferMDL    = 00000000
  UrbLink              = 00000000
[73085 ms] UsbSnoop - MyInternalIOCTLCompletion(f7940db0) : fido=84661030, Irp=843ddae8, Context=843a3940, IRQL=2
[73085 ms]  <<<  URB 37 coming back  <<< 
-- URB_FUNCTION_BULK_OR_INTERRUPT_TRANSFER:
  PipeHandle           = 8469e8b4 [endpoint 0x00000083]
  TransferFlags        = 00000003 (USBD_TRANSFER_DIRECTION_IN, USBD_SHORT_TRANSFER_OK)
  TransferBufferLength = 00000009
  TransferBuffer       = 847645f8
  TransferBufferMDL    = 00000000
    00000000: 00 00 00 00 00 00 00 00 00
  UrbLink              = 00000000
[73575 ms] UsbSnoop - DispatchAny(f793f610) : IRP_MJ_INTERNAL_DEVICE_CONTROL
[73575 ms] UsbSnoop - MyDispatchInternalIOCTL(f7940e80) : fdo=8476dba8, Irp=84619930, IRQL=2
[73575 ms]  >>>  URB 38 going down  >>> 
-- URB_FUNCTION_BULK_OR_INTERRUPT_TRANSFER:
  PipeHandle           = 8469e8b4 [endpoint 0x00000083]
  TransferFlags        = 00000003 (USBD_TRANSFER_DIRECTION_IN, USBD_SHORT_TRANSFER_OK)
  TransferBufferLength = 00000009
  TransferBuffer       = 8440cd98
  TransferBufferMDL    = 00000000
  UrbLink              = 00000000
[73595 ms] UsbSnoop - MyInternalIOCTLCompletion(f7940db0) : fido=84661030, Irp=84619930, Context=8449f590, IRQL=2
[73595 ms]  <<<  URB 38 coming back  <<< 
-- URB_FUNCTION_BULK_OR_INTERRUPT_TRANSFER:
  PipeHandle           = 8469e8b4 [endpoint 0x00000083]
  TransferFlags        = 00000003 (USBD_TRANSFER_DIRECTION_IN, USBD_SHORT_TRANSFER_OK)
  TransferBufferLength = 00000009
  TransferBuffer       = 8440cd98
  TransferBufferMDL    = 00000000
    00000000: 00 00 00 00 03 00 00 00 00
  UrbLink              = 00000000
[75087 ms] UsbSnoop - DispatchAny(f793f610) : IRP_MJ_INTERNAL_DEVICE_CONTROL
[75087 ms] UsbSnoop - MyDispatchInternalIOCTL(f7940e80) : fdo=8476dba8, Irp=843ddae8, IRQL=2
[75087 ms]  >>>  URB 39 going down  >>> 
-- URB_FUNCTION_BULK_OR_INTERRUPT_TRANSFER:
  PipeHandle           = 8469e8b4 [endpoint 0x00000083]
  TransferFlags        = 00000003 (USBD_TRANSFER_DIRECTION_IN, USBD_SHORT_TRANSFER_OK)
  TransferBufferLength = 00000009
  TransferBuffer       = 847645f8
  TransferBufferMDL    = 00000000
  UrbLink              = 00000000
[75127 ms] UsbSnoop - MyInternalIOCTLCompletion(f7940db0) : fido=84661030, Irp=843ddae8, Context=8453c818, IRQL=2
[75127 ms]  <<<  URB 39 coming back  <<< 
-- URB_FUNCTION_BULK_OR_INTERRUPT_TRANSFER:
  PipeHandle           = 8469e8b4 [endpoint 0x00000083]
  TransferFlags        = 00000003 (USBD_TRANSFER_DIRECTION_IN, USBD_SHORT_TRANSFER_OK)
  TransferBufferLength = 00000009
  TransferBuffer       = 847645f8
  TransferBufferMDL    = 00000000
    00000000: 00 00 00 00 00 00 00 00 00
  UrbLink              = 00000000
[78132 ms] UsbSnoop - DispatchAny(f793f610) : IRP_MJ_PNP (IRP_MN_SURPRISE_REMOVAL)
[78132 ms] UsbSnoop - MyDispatchPNP(f7941ee0) : IRP_MJ_PNP (IRP_MN_SURPRISE_REMOVAL)
[78198 ms] UsbSnoop - DispatchAny(f793f610) : IRP_MJ_INTERNAL_DEVICE_CONTROL
[78198 ms] UsbSnoop - MyDispatchInternalIOCTL(f7940e80) : fdo=8476dba8, Irp=843ddae8, IRQL=0
[78198 ms]  >>>  URB 40 going down  >>> 
-- URB_FUNCTION_ABORT_PIPE:
  PipeHandle = 8469e8b4 [endpoint 0x00000083]
[78704 ms] UsbSnoop - MyInternalIOCTLCompletion(f7940db0) : fido=00000000, Irp=843ddae8, Context=8453c818, IRQL=2
[78704 ms]  <<<  URB 40 coming back  <<< 
-- URB_FUNCTION_ABORT_PIPE:
[78704 ms] UsbSnoop - DispatchAny(f793f610) : IRP_MJ_PNP (IRP_MN_REMOVE_DEVICE)
[78704 ms] UsbSnoop - MyDispatchPNP(f7941ee0) : IRP_MJ_PNP (IRP_MN_REMOVE_DEVICE)
[78704 ms] UsbSnoop - RemoveDevice(f7941e90) : fido=844c3358 pdx=844c3410
[78704 ms] UsbSnoop - DriverUnload(f7941de0) : DriverObject 84400478, IRQL=0
[78704 ms] Driver unloaded!
MyThreadFunction : myMsgCount=240 myMaxSemaphoreCount=24 myMaxIrql=2, myAllocationFailed=0, mySemaphoreFailed=0
